{
  "backend": {
    "accelerated": false,
    "implementation_version": "python-tableau-v1",
    "requested": "python",
    "selected": "python"
  },
  "environment": {
    "implementation": "CPython",
    "machine": "x86_64",
    "platform": "macOS-26.5.2-x86_64-i386-64bit",
    "processor": "i386",
    "python": "3.12.3"
  },
  "input_sha256": "71025acfc32b25e93f5c171599bfa187da5fd6b1a689ce2ffa305dd364e14e2a",
  "medians": {
    "classification_seconds": 2.5360463529941626,
    "compile_seconds": 0.22402396000688896,
    "consistency_seconds": 0.04099580500042066,
    "load_seconds": 0.0647903319913894,
    "realization_seconds": 0.7092163339839317
  },
  "outcome": {
    "error_code": null,
    "error_type": null,
    "kind": "success",
    "message": null
  },
  "peak_python_bytes": 5888640,
  "peak_rss_bytes": 52621312,
  "result_sha256": "e02aaf197a5da6513aa0bee925ad314647742c2c60f028e6885760a0f6e3a0e4",
  "samples": [
    {
      "classification_seconds": 2.2752700070268475,
      "compile_seconds": 0.6038510699872859,
      "consistency_seconds": 0.04094831401016563,
      "load_seconds": 0.06477790797362104,
      "realization_seconds": 0.6986791879753582
    },
    {
      "classification_seconds": 2.704791883006692,
      "compile_seconds": 0.22402396000688896,
      "consistency_seconds": 0.04099580500042066,
      "load_seconds": 0.0647903319913894,
      "realization_seconds": 0.7635057789739221
    },
    {
      "classification_seconds": 2.5360463529941626,
      "compile_seconds": 0.19455500901676714,
      "consistency_seconds": 0.04457163100596517,
      "load_seconds": 0.07508162996964529,
      "realization_seconds": 0.7092163339839317
    }
  ],
  "schema": "pyhermit.release-benchmark/1",
  "status": "informational-local",
  "workload": {
    "classes": 8,
    "family": "generated-taxonomy",
    "individuals": 8,
    "seed": 1729,
    "size": "small"
  }
}
